[{"index":"gauntlets-of-ogre-power","name":"Gauntlets of Ogre Power","description":"Your Strength score is 19 while you wear these gauntlets. It has no effect on you if your Strength is 19 or higher without them.","rarity":"uncommon","requiresAttunement":true,"type":"Wondrous Item","attunement_requirements":"Requires Attunement","properties":["Strength score becomes 19"]},{"index":"gem-of-brightness","name":"Gem of Brightness","description":"This gem can be worn as a headband. It sheds Bright Light in a 30-foot radius and Dim Light for an additional 30 feet while worn. While wearing it, you can take a Magic action to make it Invisible.","rarity":"uncommon","requiresAttunement":false,"type":"Wondrous Item","properties":["Sheds Bright Light in 30 ft. radius","Dim Light for additional 30 feet","Can be made Invisible as Magic action"]},{"index":"gem-of-seeing","name":"Gem of Seeing","description":"This gem can be worn as a headband. While wearing it, you have Truesight with a range of 30 feet.","rarity":"very rare","requiresAttunement":true,"type":"Wondrous Item","attunement_requirements":"Requires Attunement","properties":["Truesight with range of 30 feet"]},{"index":"giant-slayer","name":"Giant Slayer","description":"You gain a +1 bonus to attack rolls and damage rolls made with this magic weapon. When you hit a Giant with this weapon, you deal extra 1d8 damage to the Giant. On a natural 20, the target takes an extra 3d8 damage.","rarity":"uncommon","requiresAttunement":true,"type":"Weapon","subtype":"Any Melee Weapon","attunement_requirements":"Requires Attunement","properties":["+1 to attack and damage rolls","Extra 1d8 damage vs Giants","Extra 3d8 damage on natural 20 vs Giants"]},{"index":"glamoured-studded-leather","name":"Glamoured Studded Leather","description":"This armor appears to be mundane studded leather until you speak the command word. While wearing this armor, you have a +1 bonus to Armor Class. You can cast Disguise Self with it once per day.","rarity":"uncommon","requiresAttunement":true,"type":"Armor","subtype":"Studded Leather","attunement_requirements":"Requires Attunement","properties":["+1 to AC","Cast Disguise Self once per day","Appears as mundane studded leather"]},{"index":"gloves-of-missile-snaring","name":"Gloves of Missile Snaring","description":"While wearing these gloves, you gain a +2 bonus to Armor Class against ranged weapon attacks. When a creature hits you with a ranged weapon attack, you can use your Reaction to catch the missile.","rarity":"rare","requiresAttunement":true,"type":"Wondrous Item","attunement_requirements":"Requires Attunement","properties":["+2 AC vs ranged weapon attacks","Can catch ranged weapons as Reaction"]},{"index":"gloves-of-swimming-and-climbing","name":"Gloves of Swimming and Climbing","description":"While wearing these gloves, your Speed isn't reduced by wearing armor or carrying a shield. You have a Swim Speed equal to your Speed and can climb without making ability checks.","rarity":"uncommon","requiresAttunement":true,"type":"Wondrous Item","attunement_requirements":"Requires Attunement","properties":["Speed not reduced by armor/shield","Swim Speed equal to your Speed","Can climb without ability checks"]},{"index":"gloves-of-thievery","name":"Gloves of Thievery","description":"While wearing these gloves, you have Advantage on Dexterity (Sleight of Hand) checks and Dexterity (Stealth) checks made to hide.","rarity":"uncommon","requiresAttunement":true,"type":"Wondrous Item","attunement_requirements":"Requires Attunement","properties":["Advantage on Sleight of Hand checks","Advantage on Stealth checks to hide"]},{"index":"goggles-of-night","name":"Goggles of Night","description":"While wearing these goggles, you have Darkvision with a range of 120 feet. If you already have Darkvision, its range increases by 60 feet.","rarity":"uncommon","requiresAttunement":true,"type":"Wondrous Item","attunement_requirements":"Requires Attunement","properties":["Darkvision with range of 120 feet","Increases existing Darkvision by 60 feet"]},{"index":"golem-manual","name":"Golem Manual","description":"This book contains instructions for creating a specific type of Golem. A creature that studies the manual for 8 hours can create that type of Golem. The manual is destroyed in the process.","rarity":"very rare","requiresAttunement":false,"type":"Wondrous Item","properties":["Instructions for creating specific Golem type","8 hours of study required","Manual is destroyed in process","Various Golem types available"]},{"index":"grappling-hook-of-the-deep","name":"Grappling Hook of the Deep","description":"This grappling hook is made of a lightweight, noncorrosive metal. It has a 30-foot chain attached. When thrown, it expands to a 3-foot-wide hook. It can be used underwater and returns to your hand when you will it to do so.","rarity":"uncommon","requiresAttunement":false,"type":"Wondrous Item","properties":["Lightweight, noncorrosive metal","30-foot chain","Expands to 3-foot-wide hook","Works underwater","Returns to hand when willed"]},{"index":"greatsword-of-sharpness","name":"Greatsword of Sharpness","description":"You gain a +3 bonus to attack rolls and damage rolls made with this magic weapon. On a natural 20, the weapon cuts the target in two. If the target is a Large or smaller creature, it is sliced into several pieces.","rarity":"very rare","requiresAttunement":true,"type":"Weapon","subtype":"Greatsword","attunement_requirements":"Requires Attunement","properties":["+3 to attack and damage rolls","Natural 20 slices target in two","Effective against Large or smaller creatures"]},{"index":"guardian-emblem","name":"Guardian Emblem","description":"This small metal emblem can be worn as a pendant. While wearing it, you have Resistance to all damage except Psychic and Necrotic. When you drop to 0 Hit Points, the emblem shatters, and you drop to 1 Hit Point instead. The emblem is destroyed.","rarity":"very rare","requiresAttunement":false,"type":"Wondrous Item","properties":["Resistance to all damage except Psychic and Necrotic","Auto-save at 1 HP when dropped to 0","Emblem is destroyed when used"]},{"index":"hammer-of-thunderbolts","name":"Hammer of Thunderbolts","description":"This warhammer appears to be a mundane +1 warhammer. While wearing a Belt of Giant Strength and a Pair of Earth Gauntlets, the hammer becomes a +3 warhammer that deals extra 3d6 Thunder damage on a hit. You can use the hammer to call down lightning.","rarity":"legendary","requiresAttunement":true,"type":"Weapon","subtype":"Warhammer","attunement_requirements":"Requires Attunement (with Belt of Giant Strength and Earth Gauntlets)","properties":["+3 when attuned with Belt of Giant Strength and Earth Gauntlets","Extra 3d6 Thunder damage","Can call down lightning"]},{"index":"handy-haversack","name":"Handy Haversack","description":"This backpack has an interior space that is 2 feet deep, 3 feet wide, and 4 feet tall. It can hold up to 30 pounds. The haversack has 4 compartments, each with its own access door.","rarity":"uncommon","requiresAttunement":false,"type":"Wondrous Item","properties":["Interior: 2x3x4 feet","Capacity: 30 pounds","4 compartments with access doors","Weighs 5 pounds regardless of contents"]},{"index":"hat-of-disguise","name":"Hat of Disguise","description":"This hat looks like a mundane cap. While wearing it, you can cast Disguise Self as a Magic action. The hat has 3 charges and regains 1d3 expended charges daily at dawn.","rarity":"uncommon","requiresAttunement":false,"type":"Wondrous Item","properties":["3 charges","Regains 1d3 charges at dawn","Cast Disguise Self as Magic action"]},{"index":"headband-of-intellect","name":"Headband of Intellect","description":"Your Intelligence score is 19 while you wear this headband. It has no effect on you if your Intelligence is 19 or higher without it.","rarity":"uncommon","requiresAttunement":true,"type":"Wondrous Item","attunement_requirements":"Requires Attunement","properties":["Intelligence score becomes 19"]},{"index":"helm-of-brilliance","name":"Helm of Brilliance","description":"This helmet grants you a +2 bonus to Armor Class. While wearing it, you have Resistance to all damage except Psychic and Necrotic. You can cast various spells from the helm.","rarity":"legendary","requiresAttunement":true,"type":"Armor","subtype":"Helmet","attunement_requirements":"Requires Attunement","properties":["+2 to AC","Resistance to all damage except Psychic and Necrotic","Can cast various spells","Requires attunement by a Cleric, Druid, or Paladin"]},{"index":"helm-of-comprehending-languages","name":"Helm of Comprehending Languages","description":"While wearing this helmet, you can cast Comprehend Languages at will.","rarity":"uncommon","requiresAttunement":true,"type":"Wondrous Item","attunement_requirements":"Requires Attunement","properties":["Cast Comprehend Languages at will"]},{"index":"helm-of-telepathy","name":"Helm of Telepathy","description":"While wearing this helmet, you can communicate telepathically with creatures within 60 feet of you. You can cast Detect Thoughts (save DC 13) with it.","rarity":"rare","requiresAttunement":true,"type":"Wondrous Item","attunement_requirements":"Requires Attunement","properties":["Telepathic communication within 60 feet","Cast Detect Thoughts (DC 13)"]},{"index":"helm-of-underwater-action","name":"Helm of Underwater Action","description":"While wearing this helmet, you can breathe underwater. You also have a Swim Speed of 40 feet and can see clearly underwater up to 60 feet.","rarity":"uncommon","requiresAttunement":true,"type":"Wondrous Item","attunement_requirements":"Requires Attunement","properties":["Breathe underwater","Swim Speed 40 feet","See clearly underwater up to 60 feet"]}]