[{"index":"wand-of-binding","name":"Wand of Binding","description":"This wand has 7 charges. While holding it, you can expend 1 charge to cast Hold Monster or Web. The wand regains 1d7 expended charges daily at dawn.","rarity":"rare","requiresAttunement":true,"type":"Wand","attunement_requirements":"Requires Attunement by a Sorcerer, Warlock, or Wizard","properties":["7 charges","Cast Hold Monster/Web","Regains 1d7 charges at dawn"]},{"index":"wand-of-enemy-detection","name":"Wand of Enemy Detection","description":"This wand has 3 charges. While holding it, you can expend 1 charge to cast Detect Evil and Good or Detect Thoughts. The wand regains 1d3 expended charges daily at dawn.","rarity":"uncommon","requiresAttunement":false,"type":"Wand","properties":["3 charges","Cast Detect Evil and Good/Detect Thoughts","Regains 1d3 charges at dawn"]},{"index":"wand-of-fear","name":"Wand of Fear","description":"This wand has 7 charges. While holding it, you can expend 1 charge to cast Fear. The wand regains 1d7 expended charges daily at dawn.","rarity":"rare","requiresAttunement":true,"type":"Wand","attunement_requirements":"Requires Attunement by a Sorcerer, Warlock, or Wizard","properties":["7 charges","Cast Fear","Regains 1d7 charges at dawn"]},{"index":"wand-of-fireballs","name":"Wand of Fireballs","description":"This wand has 7 charges. While holding it, you can expend 1 charge to cast Fireball (level 5). The wand regains 1d7 expended charges daily at dawn.","rarity":"rare","requiresAttunement":true,"type":"Wand","attunement_requirements":"Requires Attunement by a Sorcerer, Warlock, or Wizard","properties":["7 charges","Cast Fireball (level 5)","Regains 1d7 charges at dawn"]},{"index":"wand-of-lightning-bolts","name":"Wand of Lightning Bolts","description":"This wand has 7 charges. While holding it, you can expend 1 charge to cast Lightning Bolt (level 5). The wand regains 1d7 expended charges daily at dawn.","rarity":"rare","requiresAttunement":true,"type":"Wand","attunement_requirements":"Requires Attunement by a Sorcerer, Warlock, or Wizard","properties":["7 charges","Cast Lightning Bolt (level 5)","Regains 1d7 charges at dawn"]},{"index":"wand-of-magic-detection","name":"Wand of Magic Detection","description":"This wand has 3 charges. While holding it, you can expend 1 charge to cast Detect Magic or Detect Thoughts. The wand regains 1d3 expended charges daily at dawn.","rarity":"uncommon","requiresAttunement":false,"type":"Wand","properties":["3 charges","Cast Detect Magic/Detect Thoughts","Regains 1d3 charges at dawn"]},{"index":"wand-of-magic-missiles","name":"Wand of Magic Missiles","description":"This wand has 7 charges. While holding it, you can expend 1 charge to cast Magic Missile. The wand regains 1d7 expended charges daily at dawn.","rarity":"uncommon","requiresAttunement":false,"type":"Wand","properties":["7 charges","Cast Magic Missile","Regains 1d7 charges at dawn"]},{"index":"wand-of-paralysis","name":"Wand of Paralysis","description":"This wand has 7 charges. While holding it, you can expend 1 charge to cast Hold Person. The wand regains 1d7 expended charges daily at dawn.","rarity":"rare","requiresAttunement":true,"type":"Wand","attunement_requirements":"Requires Attunement by a Sorcerer, Warlock, or Wizard","properties":["7 charges","Cast Hold Person","Regains 1d7 charges at dawn"]},{"index":"wand-of-polymorph","name":"Wand of Polymorph","description":"This wand has 7 charges. While holding it, you can expend 1 charge to cast Polymorph. The wand regains 1d7 expended charges daily at dawn.","rarity":"very rare","requiresAttunement":true,"type":"Wand","attunement_requirements":"Requires Attunement by a Sorcerer, Warlock, or Wizard","properties":["7 charges","Cast Polymorph","Regains 1d7 charges at dawn"]},{"index":"wand-of-secrets","name":"Wand of Secrets","description":"This wand has 3 charges. While holding it, you can expend 1 charge to cast Locate Object or See Invisibility. The wand regains 1d3 expended charges daily at dawn.","rarity":"uncommon","requiresAttunement":false,"type":"Wand","properties":["3 charges","Cast Locate Object/See Invisibility","Regains 1d3 charges at dawn"]},{"index":"wand-of-the-war-mage-bonus-1","name":"Wand of the War Mage (+1)","description":"This wand has a +1 bonus to attack rolls and damage rolls made with it. While holding it, you have a +1 bonus to spell attack rolls.","rarity":"uncommon","requiresAttunement":true,"type":"Wand","attunement_requirements":"Requires Attunement by a Sorcerer, Warlock, or Wizard","properties":["+1 to attack and damage rolls","+1 to spell attack rolls"]},{"index":"wand-of-the-war-mage-bonus-2","name":"Wand of the War Mage (+2)","description":"This wand has a +2 bonus to attack rolls and damage rolls made with it. While holding it, you have a +2 bonus to spell attack rolls.","rarity":"rare","requiresAttunement":true,"type":"Wand","attunement_requirements":"Requires Attunement by a Sorcerer, Warlock, or Wizard","properties":["+2 to attack and damage rolls","+2 to spell attack rolls"]},{"index":"wand-of-the-war-mage-bonus-3","name":"Wand of the War Mage (+3)","description":"This wand has a +3 bonus to attack rolls and damage rolls made with it. While holding it, you have a +3 bonus to spell attack rolls.","rarity":"very rare","requiresAttunement":true,"type":"Wand","attunement_requirements":"Requires Attunement by a Sorcerer, Warlock, or Wizard","properties":["+3 to attack and damage rolls","+3 to spell attack rolls"]},{"index":"weapon-1-2-3","name":"Weapon, +1, +2, or +3","description":"You have a bonus to attack rolls and damage rolls made with this magic weapon. The bonus is determined by its rarity.","rarity":"rare","requiresAttunement":false,"type":"Weapon","subtype":"Any Melee or Ranged Weapon","properties":["+1 (uncommon)","+2 (rare)","+3 (very rare)"]},{"index":"well-of-many-worlds","name":"Well of Many Worlds","description":"This well is a portal to various planes of existence. While standing at the edge of the well, you can take a Magic action to peer into the well and see different planes.","rarity":"legendary","requiresAttunement":false,"type":"Wondrous Item","properties":["Portal to various planes","Peek into different planes","Can travel to planes","Requires specific conditions to activate"]},{"index":"winged-boots","name":"Winged Boots","description":"While wearing these boots, you have a Fly Speed of 30 feet (or 40 feet if you're not carrying heavy loads). The boots have 3 charges and regains 1d3 expended charges daily at dawn.","rarity":"uncommon","requiresAttunement":true,"type":"Wondrous Item","attunement_requirements":"Requires Attunement","properties":["Fly Speed 30 ft. (40 ft. without heavy load)","3 charges","Regains 1d3 charges at dawn"]},{"index":"wings-of-flying","name":"Wings of Flying","description":"This pair of wings can be attached to your back. While attached, you have a Fly Speed of 60 feet. The wings can be detached and reattached as a Magic action.","rarity":"rare","requiresAttunement":true,"type":"Wondrous Item","attunement_requirements":"Requires Attunement","properties":["Fly Speed 60 feet","Can be attached/detached as Magic action"]},{"index":"yklwa-of-the-ancients","name":"Yklwa of the Ancients","description":"You gain a +1 bonus to attack rolls and damage rolls made with this magic weapon. When you hit a creature with this weapon, you can expend 1 charge to deal extra 1d6 Force damage.","rarity":"uncommon","requiresAttunement":true,"type":"Weapon","subtype":"Yklwa","attunement_requirements":"Requires Attunement","properties":["+1 to attack and damage rolls","Extra 1d6 Force damage per charge","1d6+1 charges per day","Regains charges at dawn"]}]